{
 "urls": [
  "https://arxiv.org/abs/2606.03461",
  "https://arxiv.org/pdf/2606.03461"
 ],
 "wayback": [],
 "captures": [
  {
   "id": "S1",
   "kind": "fetch",
   "url": "https://arxiv.org/pdf/2606.03461",
   "captured": "2026-10-20T05:38:52Z",
   "note": "PDF saved by salvo gt/t3; text = the saved extraction 2606.03461.txt (74 KB)"
  }
 ],
 "commit": null,
 "sha256": {
  "/work/.salvo14/gt/t3/src/pdf/2606.03461.pdf": "86e9234657a6a0599863f86555d0023d07f1c7521d8c0b919f806612955d915c",
  "/work/.salvo14/gt/t3/src/pdf/2606.03461.txt": "17848e1c993c6c79cacaedc69571362c568a75916542929a9ec356114d5cd8dd"
 },
 "harvested_at": "2026-10-20T05:38:52Z",
 "published": {
  "value": "2026-06-02",
  "where": "arXiv header",
  "quote": "arXiv:2606.03461v1 [cs.AI] 2 Jun 2026",
  "file": "/work/.salvo14/gt/t3/src/pdf/2606.03461.txt"
 },
 "salvo": "salvo14/mig C2 wave (28 Oct, C2-4)",
 "agent": "converter (Haiku 5.5), from the saved PDF text",
 "snapshot_of": null,
 "extractions": [
  {
   "file": "/work/.salvo14/gt/t3/src/pdf/2606.03461.txt",
   "from": "/work/.salvo14/gt/t3/src/pdf/2606.03461.pdf",
   "tool": "saved text of gt/t3 (pdf text extraction, as the legacy ref)"
  }
 ],
 "id": "src-arxiv-2606.03461-v1-2026-06-02",
 "publisher": "arxiv-2606.03461",
 "facts": [
  {
   "level": "written",
   "file": "/work/.salvo14/gt/t3/src/pdf/2606.03461.txt",
   "says": "version",
   "value": "v1",
   "form": "prose",
   "where": "page header",
   "quote": "arXiv:2606.03461v1 [cs.AI] 2 Jun 2026",
   "id": "F1",
   "about": null
  },
  {
   "level": "written",
   "file": "/work/.salvo14/gt/t3/src/pdf/2606.03461.txt",
   "says": "metric-definition",
   "value": "TB 2.0",
   "form": "label",
   "where": "Table 1, column header",
   "quote": "Teacher Model Trajectory Num. TB 2.0 Avg. Turns SFT Avg. Pass@1",
   "note": "Table 1's teacher column (one score per teacher, the standalone TB 2.0 score); the two SFT columns are student results and are not used",
   "id": "F2",
   "about": null
  },
  {
   "level": "written",
   "file": "/work/.salvo14/gt/t3/src/pdf/2606.03461.txt",
   "says": "metric-definition",
   "value": "Teacher Strength (TB@2.0)",
   "form": "label",
   "where": "Figure 1, panel title",
   "quote": "Teacher Strength (TB@2.0)",
   "id": "F3",
   "about": null
  },
  {
   "level": "written",
   "file": "/work/.salvo14/gt/t3/src/pdf/2606.03461.txt",
   "says": "metric-definition",
   "value": "Terminal-Bench 2.0",
   "form": "prose",
   "where": "abstract, lines 15-16",
   "quote": "while Claude Opus 4.6 achieves higher scores on Terminal-Bench 2.0",
   "id": "F4",
   "about": null
  },
  {
   "level": "written",
   "file": "/work/.salvo14/gt/t3/src/pdf/2606.03461.txt",
   "says": "harness",
   "value": "Terminus-2",
   "term": "terminus-2",
   "form": "prose",
   "where": "section 2, paragraph 2 (teacher trajectory collection)",
   "quote": "a fixed agent harness, Terminus-2 [13]",
   "note": "stated for trajectory collection and student evaluation; the paper does not say which harness produced the TB 2.0 teacher score (not used on the measures)",
   "id": "F5",
   "about": null
  },
  {
   "level": "written",
   "file": "/work/.salvo14/gt/t3/src/pdf/2606.03461.txt",
   "says": "model-name",
   "about": "Claude Opus 4.6",
   "value": "Claude Opus 4.6",
   "form": "table-cell",
   "where": "Table 1, Teacher Model column",
   "quote": "Claude Opus 4.6 8.1K 69.4 3.8 5.6% 15.5%",
   "id": "F6"
  },
  {
   "level": "written",
   "file": "/work/.salvo14/gt/t3/src/pdf/2606.03461.txt",
   "says": "score",
   "about": "Claude Opus 4.6",
   "value": "69.4",
   "term": "score%",
   "scale": "percent",
   "precision": {
    "model": "printed",
    "step": 0.1
   },
   "form": "table-cell",
   "where": "Table 1, row Claude Opus 4.6, column TB 2.0",
   "quote": "Claude Opus 4.6 8.1K 69.4 3.8 5.6% 15.5%",
   "id": "F7"
  },
  {
   "level": "written",
   "file": "/work/.salvo14/gt/t3/src/pdf/2606.03461.txt",
   "says": "model-name",
   "about": "Qwen3.5-Plus",
   "value": "Qwen3.5-Plus",
   "form": "table-cell",
   "where": "Table 1, Teacher Model column",
   "quote": "Qwen3.5-Plus 8.1K 52.5 6.7 8.6% 17.2%",
   "id": "F8"
  },
  {
   "level": "written",
   "file": "/work/.salvo14/gt/t3/src/pdf/2606.03461.txt",
   "says": "score",
   "about": "Qwen3.5-Plus",
   "value": "52.5",
   "term": "score%",
   "scale": "percent",
   "precision": {
    "model": "printed",
    "step": 0.1
   },
   "form": "table-cell",
   "where": "Table 1, row Qwen3.5-Plus, column TB 2.0",
   "quote": "Qwen3.5-Plus 8.1K 52.5 6.7 8.6% 17.2%",
   "id": "F9"
  },
  {
   "level": "written",
   "file": "/work/.salvo14/gt/t3/src/pdf/2606.03461.txt",
   "says": "model-name",
   "about": "GLM-5",
   "value": "GLM-5",
   "form": "table-cell",
   "where": "Table 1, Teacher Model column",
   "quote": "GLM-5 8.1K 56.2 5.4 8.6% 19.5%",
   "id": "F10"
  },
  {
   "level": "written",
   "file": "/work/.salvo14/gt/t3/src/pdf/2606.03461.txt",
   "says": "score",
   "about": "GLM-5",
   "value": "56.2",
   "term": "score%",
   "scale": "percent",
   "precision": {
    "model": "printed",
    "step": 0.1
   },
   "form": "table-cell",
   "where": "Table 1, row GLM-5, column TB 2.0",
   "quote": "GLM-5 8.1K 56.2 5.4 8.6% 19.5%",
   "id": "F11"
  },
  {
   "level": "written",
   "file": "/work/.salvo14/gt/t3/src/pdf/2606.03461.txt",
   "says": "model-name",
   "about": "DeepSeek-V3.2",
   "value": "DeepSeek-V3.2",
   "form": "table-cell",
   "where": "Table 1, Teacher Model column",
   "quote": "DeepSeek-V3.2 8.1K 39.3 7.310.5% 20.6%",
   "id": "F12"
  },
  {
   "level": "written",
   "file": "/work/.salvo14/gt/t3/src/pdf/2606.03461.txt",
   "says": "score",
   "about": "DeepSeek-V3.2",
   "value": "39.3",
   "term": "score%",
   "scale": "percent",
   "precision": {
    "model": "printed",
    "step": 0.1
   },
   "form": "table-cell",
   "where": "Table 1, row DeepSeek-V3.2, column TB 2.0",
   "quote": "DeepSeek-V3.2 8.1K 39.3 7.310.5% 20.6%",
   "id": "F13"
  },
  {
   "level": "written",
   "file": "/work/.salvo14/gt/t3/src/pdf/2606.03461.txt",
   "says": "score",
   "about": "Claude Opus 4.6",
   "value": "62.9",
   "term": "score%",
   "scale": "percent",
   "form": "table-cell",
   "where": "Table 8, official leaderboard references, row Claude Opus 4.6 (Terminus-2)",
   "quote": "Claude Opus 4.6[4] – – Terminus-2 62.9",
   "note": "not converted: official leaderboard row, another setup; differs from Table 1 (69.4)",
   "id": "F14"
  },
  {
   "level": "written",
   "file": "/work/.salvo14/gt/t3/src/pdf/2606.03461.txt",
   "says": "score",
   "about": "GLM 5",
   "value": "52.4",
   "term": "score%",
   "scale": "percent",
   "form": "table-cell",
   "where": "Table 8, official leaderboard references, row GLM 5 (Terminus-2)",
   "quote": "GLM 5[2] 744B – Terminus-2 52.4",
   "note": "not converted: official leaderboard row; Table 1 gives 56.2",
   "id": "F15"
  },
  {
   "level": "written",
   "file": "/work/.salvo14/gt/t3/src/pdf/2606.03461.txt",
   "says": "score",
   "about": "DeepSeek-V3.2",
   "value": "39.6",
   "term": "score%",
   "scale": "percent",
   "form": "table-cell",
   "where": "Table 8, official leaderboard references, row DeepSeek-V3.2 (Terminus-2)",
   "quote": "DeepSeek-V3.2[12] 685B – Terminus-2 39.6",
   "note": "not converted: official leaderboard row; Table 1 gives 39.3",
   "id": "F16"
  }
 ]
}