{
 "id": "src-livemace-2610.09872-2026-10-20",
 "publisher": "livemace-2610.09872",
 "urls": [
  "https://arxiv.org/abs/2610.09872",
  "https://arxiv.org/pdf/2610.09872"
 ],
 "wayback": [],
 "captures": [
  {
   "id": "S1",
   "kind": "fetch",
   "url": "https://arxiv.org/pdf/2610.09872",
   "captured": "2026-10-20",
   "file": "/work/.salvo14/mig/convert-livemace-2610.09872/evidence/livemace-2610.09872.pdf",
   "note": "saved PDF (salvo14 gt/t1/pdf/2610.09872.pdf, file time 2026-10-20); arXiv:2610.09872v1; quotes are matched on its text extraction (gt/t1/ptxt, copied here)"
  }
 ],
 "commit": null,
 "sha256": {
  "/work/.salvo14/mig/convert-livemace-2610.09872/evidence/livemace-2610.09872.pdf": "4deab047f5d3ada89e377853196e1f7872402147469945da7672c0e0754d7a03",
  "/work/.salvo14/mig/convert-livemace-2610.09872/evidence/livemace-2610.09872.txt": "31999db6f8c313f2dcef2f6b013e3dd20b86d06a48c6f788bc7adbb5b6b6109e"
 },
 "extractions": [
  {
   "file": "/work/.salvo14/mig/convert-livemace-2610.09872/evidence/livemace-2610.09872.txt",
   "from": "/work/.salvo14/mig/convert-livemace-2610.09872/evidence/livemace-2610.09872.pdf",
   "tool": "text of the PDF as saved by salvo14 (gt/t1/ptxt/2610.09872.txt); table rows as extracted"
  }
 ],
 "harvested_at": "2026-10-20T00:00:00Z",
 "published": {
  "value": "2026-10-07",
  "where": "arXiv stamp, page 1",
  "quote": "7 Oct 2026",
  "file": "/work/.salvo14/mig/convert-livemace-2610.09872/evidence/livemace-2610.09872.txt"
 },
 "salvo": "salvo14/mig convert-livemace-2610.09872 (wave C2)",
 "agent": "converter (wave C2), from the saved copy and its text",
 "snapshot_of": null,
 "facts": [
  {
   "id": "F1",
   "says": "metric-definition",
   "about": null,
   "value": "Hard-rule Pass Rate (HPR)",
   "level": "written",
   "form": "prose",
   "where": "section 2 'Rule Following', objective metrics (bullet list)",
   "file": "/work/.salvo14/mig/convert-livemace-2610.09872/evidence/livemace-2610.09872.txt",
   "quote": "Hard-rule Pass Rate (HPR). HPRmeasures compliance with the R0 and R1 hard constraints."
  },
  {
   "id": "F2",
   "says": "harness",
   "about": null,
   "value": "common ReAct scaffold",
   "level": "written",
   "form": "prose",
   "where": "section 2, paragraph on the controlled variants",
   "file": "/work/.salvo14/mig/convert-livemace-2610.09872/evidence/livemace-2610.09872.txt",
   "quote": "multi-agent collaboration on top of a common ReAct scaffold"
  },
  {
   "id": "F3",
   "says": "run-end",
   "about": null,
   "value": "May 13, 2026",
   "level": "written",
   "form": "prose",
   "where": "section 3 'Evaluation' (the start, April 13, is printed without its year: not converted)",
   "file": "/work/.salvo14/mig/convert-livemace-2610.09872/evidence/livemace-2610.09872.txt",
   "quote": "over an approximately 30-day live paper-trading period from April 13 to May 13, 2026."
  },
  {
   "id": "F5",
   "says": "model-name",
   "about": "GPT-5.4",
   "value": "GPT-5.4",
   "level": "written",
   "form": "prose",
   "where": "section 3 'Evaluation'",
   "file": "/work/.salvo14/mig/convert-livemace-2610.09872/evidence/livemace-2610.09872.txt",
   "quote": "We evaluate five frontier LLMs—GPT-5.4 [12]"
  },
  {
   "id": "F6",
   "says": "score",
   "about": "GPT-5.4",
   "value": "0.682",
   "level": "written",
   "form": "table-cell",
   "where": "Table 2, row GPT-5.4, column HPR",
   "file": "/work/.salvo14/mig/convert-livemace-2610.09872/evidence/livemace-2610.09872.txt",
   "quote": "GPT-5.4 +5.738% 5.169% 0.682 0.634 0.677",
   "term": "score-of-1",
   "scale": "fraction",
   "precision": {
    "model": "printed",
    "step": 0.001
   }
  },
  {
   "id": "F7",
   "says": "score",
   "about": "DeepSeek-V3.2",
   "value": "0.877",
   "level": "written",
   "form": "table-cell",
   "where": "Table 2, row DeepSeek-V3.2, column HPR",
   "file": "/work/.salvo14/mig/convert-livemace-2610.09872/evidence/livemace-2610.09872.txt",
   "quote": "DeepSeek-V3.2+5.765% 4.270%0.877",
   "term": "score-of-1",
   "scale": "fraction",
   "precision": {
    "model": "printed",
    "step": 0.001
   }
  },
  {
   "id": "F8",
   "says": "score",
   "about": "Gemini-3.1-Pro",
   "value": "0.888",
   "level": "written",
   "form": "table-cell",
   "where": "Table 2, row Gemini-3.1-Pro, column HPR",
   "file": "/work/.salvo14/mig/convert-livemace-2610.09872/evidence/livemace-2610.09872.txt",
   "quote": "Gemini-3.1-Pro +3.503% 4.927%0.888",
   "term": "score-of-1",
   "scale": "fraction",
   "precision": {
    "model": "printed",
    "step": 0.001
   }
  },
  {
   "id": "F9",
   "says": "score",
   "about": "Grok-4.20",
   "value": "0.834",
   "level": "written",
   "form": "table-cell",
   "where": "Table 2, row Grok-4.20, column HPR",
   "file": "/work/.salvo14/mig/convert-livemace-2610.09872/evidence/livemace-2610.09872.txt",
   "quote": "Grok-4.20 +3.085% 5.165% 0.834",
   "term": "score-of-1",
   "scale": "fraction",
   "precision": {
    "model": "printed",
    "step": 0.001
   }
  },
  {
   "id": "F10",
   "says": "model-name",
   "about": "DeepSeek-V3.2",
   "value": "DeepSeek-V3.2",
   "level": "written",
   "form": "table-cell",
   "where": "Table 2, row DeepSeek-V3.2",
   "file": "/work/.salvo14/mig/convert-livemace-2610.09872/evidence/livemace-2610.09872.txt",
   "quote": "DeepSeek-V3.2+5.765% 4.270%0.877"
  },
  {
   "id": "F11",
   "says": "model-name",
   "about": "Gemini-3.1-Pro",
   "value": "Gemini-3.1-Pro",
   "level": "written",
   "form": "table-cell",
   "where": "Table 2, row Gemini-3.1-Pro",
   "file": "/work/.salvo14/mig/convert-livemace-2610.09872/evidence/livemace-2610.09872.txt",
   "quote": "Gemini-3.1-Pro +3.503% 4.927%0.888"
  },
  {
   "id": "F12",
   "says": "model-name",
   "about": "Grok-4.20",
   "value": "Grok-4.20",
   "level": "written",
   "form": "table-cell",
   "where": "Table 2, row Grok-4.20",
   "file": "/work/.salvo14/mig/convert-livemace-2610.09872/evidence/livemace-2610.09872.txt",
   "quote": "Grok-4.20 +3.085% 5.165% 0.834"
  }
 ]
}