{
 "id": "src-vals.ai-tax_agent_bench-2026-10-06",
 "publisher": "vals.ai",
 "urls": [
  "https://vals.ai/benchmarks/tax_agent_bench"
 ],
 "wayback": [],
 "commit": null,
 "sha256": {
  "/work/.salvo14/s20/cache/c3/src/vals_valstax.html": "100fa6d94473fd96a170b611b0a88fb975e120cb7bbd0c265d1866ce3b0d61d4",
  "/work/.salvo14/mig/convert-vals.ai/extract/src-vals.ai-tax_agent_bench-2026-10-06.json": "481ee16d886bd5feb9a65150ff62c34b295dbda4b03dbd3aaca36b86527e086c"
 },
 "harvested_at": "2026-10-08T03:13:14Z",
 "published": {
  "value": "2026-10-06",
  "where": "board page header \"Updated M/D/YYYY\" (payload metadata.updated)",
  "quote": "updated 10/6/2026",
  "file": "/work/.salvo14/s20/cache/c3/src/vals_valstax.html"
 },
 "salvo": "salvo14/mig/convert-vals.ai (Wave C1)",
 "agent": "convert-vals.ai (Sonnet 5.5)",
 "snapshot_of": null,
 "captures": [
  {
   "id": "S1",
   "kind": "fetch",
   "url": "https://vals.ai/benchmarks/tax_agent_bench",
   "captured": "2026-10-08T03:13:14Z",
   "note": "captured = the file modification time of our saved copy of the board page"
  }
 ],
 "extractions": [
  {
   "file": "/work/.salvo14/mig/convert-vals.ai/extract/src-vals.ai-tax_agent_bench-2026-10-06.json",
   "from": "/work/.salvo14/s20/cache/c3/src/vals_valstax.html",
   "tool": "convert_vals.py / vpage.py (astro-island props decoded, numbers verbatim)"
  }
 ],
 "tables": [
  {
   "id": "T1",
   "file": "/work/.salvo14/mig/convert-vals.ai/extract/src-vals.ai-tax_agent_bench-2026-10-06.json",
   "where": "$.tasks.overall",
   "format": "json",
   "row_key": "model",
   "columns": {
    "model": {
     "says": "model-api-id",
     "namespace": "prefix",
     "note": "the board's model key; its head up to '/' is the board's provider prefix (not a route statement)"
    },
    "accuracy": {
     "says": "score",
     "term": "score%",
     "scale": "percent",
     "precision": {
      "model": "printed",
      "step": 0.001
     }
    },
    "cost_per_test": {
     "says": "cost",
     "precision": {
      "model": "printed",
      "step": 1e-06
     }
    },
    "reasoning_effort": "effort-setting",
    "compute_effort": "effort-setting",
    "harness": "harness",
    "provider": "note",
    "latency": "note",
    "stderr": "note",
    "token_totals.input_tokens": "tokens-in",
    "token_totals.output_tokens": "tokens-out",
    "token_totals.reasoning_tokens": "tokens-reasoning",
    "token_totals.cache_read_tokens": "tokens-cache-read"
   },
   "level": "written"
  }
 ],
 "facts": [
  {
   "id": "F1",
   "says": "version",
   "value": "1",
   "level": "written",
   "form": "code",
   "file": "/work/.salvo14/s20/cache/c3/src/vals_valstax.html",
   "where": "payload metadata of the board (benchmarkView.metadata.version in the page's astro-island props)",
   "quote": "\"version\":[0,\"1\"]",
   "about": null
  },
  {
   "id": "F2",
   "says": "unit",
   "value": "cost_per_test",
   "term": "per-test",
   "level": "written",
   "form": "label",
   "file": "/work/.salvo14/s20/cache/c3/src/vals_valstax.html",
   "where": "payload key cost_per_test of every model entry of the board",
   "quote": "\"cost_per_test\"",
   "about": null
  },
  {
   "id": "F3",
   "says": "currency",
   "value": "$",
   "term": "USD",
   "level": "written",
   "form": "table-cell",
   "file": "/work/.salvo14/s20/cache/c3/src/vals_valstax.html",
   "where": "leaderboard table of the page: the first cost printed with a $ sign",
   "quote": "$13.18",
   "about": null
  },
  {
   "id": "F4",
   "says": "headline-metric",
   "value": "Accuracy",
   "level": "written",
   "form": "label",
   "file": "/work/.salvo14/s20/cache/c3/src/vals_valstax.html",
   "where": "board page: the \"Accuracy\" column / axis label and the payload key accuracy",
   "quote": "accuracy",
   "about": null
  },
  {
   "says": "route",
   "about": "anthropic/claude-opus-5-5",
   "value": "Anthropic",
   "term": "maker-api",
   "level": "written",
   "form": "data-file",
   "table": "T1",
   "where": "row anthropic/claude-opus-5-5, column provider",
   "id": "F11"
  },
  {
   "says": "route",
   "about": "anthropic/claude-opus-5",
   "value": "Anthropic",
   "term": "maker-api",
   "level": "written",
   "form": "data-file",
   "table": "T1",
   "where": "row anthropic/claude-opus-5, column provider",
   "id": "F12"
  },
  {
   "says": "route",
   "about": "anthropic/claude-fable-5-1",
   "value": "Anthropic",
   "term": "maker-api",
   "level": "written",
   "form": "data-file",
   "table": "T1",
   "where": "row anthropic/claude-fable-5-1, column provider",
   "id": "F13"
  },
  {
   "says": "route",
   "about": "anthropic/claude-sonnet-5",
   "value": "Anthropic",
   "term": "maker-api",
   "level": "written",
   "form": "data-file",
   "table": "T1",
   "where": "row anthropic/claude-sonnet-5, column provider",
   "id": "F14"
  },
  {
   "says": "route",
   "about": "anthropic/claude-sonnet-5-5",
   "value": "Anthropic",
   "term": "maker-api",
   "level": "written",
   "form": "data-file",
   "table": "T1",
   "where": "row anthropic/claude-sonnet-5-5, column provider",
   "id": "F15"
  },
  {
   "says": "route",
   "about": "anthropic/claude-fable-5",
   "value": "Anthropic",
   "term": "maker-api",
   "level": "written",
   "form": "data-file",
   "table": "T1",
   "where": "row anthropic/claude-fable-5, column provider",
   "id": "F16"
  },
  {
   "says": "route",
   "about": "anthropic/claude-opus-4-8",
   "value": "Anthropic",
   "term": "maker-api",
   "level": "written",
   "form": "data-file",
   "table": "T1",
   "where": "row anthropic/claude-opus-4-8, column provider",
   "id": "F17"
  },
  {
   "says": "thinking-on",
   "about": "anthropic/claude-sonnet-4-6",
   "value": "reasoning: true",
   "level": "written",
   "form": "data-file",
   "table": "T1",
   "where": "row anthropic/claude-sonnet-4-6, column reasoning (payload field reasoning = true)",
   "id": "F18"
  },
  {
   "says": "route",
   "about": "anthropic/claude-sonnet-4-6",
   "value": "Anthropic",
   "term": "maker-api",
   "level": "written",
   "form": "data-file",
   "table": "T1",
   "where": "row anthropic/claude-sonnet-4-6, column provider",
   "id": "F19"
  },
  {
   "says": "route",
   "about": "anthropic/claude-opus-4-7",
   "value": "Anthropic",
   "term": "maker-api",
   "level": "written",
   "form": "data-file",
   "table": "T1",
   "where": "row anthropic/claude-opus-4-7, column provider",
   "id": "F20"
  },
  {
   "says": "route",
   "about": "anthropic/claude-haiku-4-5-20251001-thinking",
   "value": "Anthropic",
   "term": "maker-api",
   "level": "written",
   "form": "data-file",
   "table": "T1",
   "where": "row anthropic/claude-haiku-4-5-20251001-thinking, column provider",
   "id": "F21"
  }
 ]
}
